location,title,company,salary,summary
"Norcross, GA",Business Research Analyst,    CI Radar,31000.0,"Become a subject matter expert on clients’ market space, competitors, and products. The analyst will be assigned clients and will be in charge of creating and..."
"Atlanta, GA",Data Scientist - Healthcare,    Harnham,170000.0,"Machine learning, data visualization, statistical modeling, data mining, or information retrieval. The award winning Advanced Data & Analytics team is involved..."
"Roswell, GA",Senior Statistical Consultant,        Principle Solutions Group,120000.0,"R and/or Python experience a plus. For immediate consideration, please send your MS Word formatted resume to caroline.railey@principlesolutions.com...."
"Atlanta, GA",Solutions Development Engineer,        Oversight Systems,58600.0,"Oversight reduces the need for hard-­-to-­-find data scientists and reduces the cost for analysis. Through Insights On Demand, Oversight provides customer-­..."
"Cincinnati, OH",Senior Quantitative Analyst,    3coast,115000.0,"Other project s/t asks as assigned by MRM management . Statistics, math, physics, finance etc.). Prefer LOCAL AREA candidates, as NO relocation is being paid by..."
"Cincinnati, OH",Operations Research Analyst,    Careerfits,79420.0,"Define data requirements and gather and validate information, applying judgment and statistical tests. Analytical or scientific software...."
"Cincinnati, OH",Process Engineer Manager,    Sirrus Chemistry,110000.0,"Collaborate with other R&D scientists and other departments to effectively support projects. Direct budget responsibility, including overall project..."
"St. Louis, MO",Staff Scientist - Computational Genetics - Cardiology,        Washington University in St. Louis,54095.5,We study these problems in hopes of applying genetic findings and techniques to improve clinical care and human health....
"St. Louis, MO",Staff Scientist - Ophthalmology & Visual Science,        Washington University in St. Louis,54095.5,"Ability to analyze and interpret statistical data and to communicate data in a clear, concise manner. Performs complex statistical analysis of data collected..."
"St. Louis, MO",Senior Scientist - Psychiatry,        Washington University in St. Louis,56988.5,"We are seeking applicants for a Senior Scientist positions to work with highly dimensional data, especially next-generation sequencing data (WES, WGS and RNA..."
"St. Louis, MO",Staff Scientist - Pediatrics Gastroenterology,        Washington University in St. Louis,54095.5,"Ability to analyze and interpret statistical data and to communicate data in a clear, concise manner. Performs complex statistical analysis of data collected..."
"Creve Coeur, MO",Senior Java Full Stack Developer,        Mastech Digital,112500.0,Think through complex scientific problems and work to solve them by applying cutting edge data engineering practices....
"Tampa, FL",Market Research Analyst,"    The Klages Group/Research Data Services, Inc.",50000.0,"Available start date. The analyst position involves handling descriptive survey information, summarizing and displaying data using tables and graphs, client..."
"Tampa, FL 33609 (Swann Estates area)",Marketing Research Analyst,"        Vaco, LLC",55000.0,We offer you a solution - a career solution that allows you to free yourself to focus on what you do best....
"Pleasanton, CA 94588",Senior Machine Learning Data Scientist,        Workbridge Associates,200000.0,
"Oakland, CA",Full-stack designer,    Even,34142.0,Work side by side with data scientists and researchers to understand the problems you’re solving and whether your solutions are helping....
"Berkeley, CA",Lecturer - Sutardja Center for Entrepreneurship & Technology,        University of California Berkeley,108607.5,"Established in 2005, SCET's mission has been to equip engineers and scientists with the skills to innovate, productize, and commercialize technology in the..."
"Berkeley, CA",Postdoctoral Scholar - Building Blocks of Cognition Laborato...,        University of California Berkeley,50178.0,Neuroimaging data analysis and longitudinal data analysis. The incumbent will work in the Building Blocks of Cognition laboratory of Professor Silvia Bunge at...
"Austin, TX",Research Scientist,    Senseye,82500.0,"Extensive experience in Bayesian modeling with an emphasis on Hidden Markov Models, Restricted Boltzmann Machines, Gaussian Mixture Models, and other types of..."
"Austin, TX 78746",Senior Research Scientist (Principal Investigator level),    Gibson - An Education Consulting & Research Group,130000.0,"These roles include the responsibilities typically associated with project directorship, including overseeing and contributing to proposal development with a..."
"Austin, TX",Planner Sr (Statistician),        Travis County,58916.5,"Performs professional statistician work, including planning, developing and implementing highly advanced complex projects and programs with broad scope, and..."
"Austin, TX 78759 (Arboretum area)",Bioinformatics Specialist-Metagenomics/Proteomics,"        Signature Science, LLC",90000.0,"The Bioinformatics Specialist will work within a team of molecular biologists, forensic scientists, biochemists, bioinformaticians, database managers,..."
"Austin, TX 78759 (Arboretum area)",Computer Scientist/Software Engineer,"        Signature Science, LLC",79000.0,"Develop and implement application test plans, including both integration and full system test plans for publications, software and training materials...."
"Austin, TX 78701 (Downtown area)",Permitting Specialist,    JE Compliance,43500.0,"JECSI is a mid-sized company of environmental consultants and engineers and technical, scientific, and business software application developers and engineers..."
"Austin, TX",JavaScript Developer,    Oscar Technology,120000.0,The MEAN Stack JavaScript Developer will be working alongside Data Scientists responsible for creating web and mobile products for the Medical / Pharmaceutical...
"Austin, TX","Laboratory Supervisor, Microbiology (Days)",    Lighthouse Recruiting,90000.0,"Join our Medical Laboratory Scientists Groups:. The Laboratorian features a list of open clinical lab jobs, the latest industry news, salary information,..."
"Austin, TX 78701 (Downtown area)",Full Stack JavaScript Developer - MEAN stack,,100000.0,"They offer unlimited PTO, flexible working hours, stock options and an excellent environment for growth.The RoleThe MEAN Stack JavaScript Developer will be..."
"Houston, TX",Data Scientist,    Platinum Solutions,100000.0,The Data Scientist works with the advanced analytics team on data and business intelligence resources to build and deliver advanced analytics capabilities to...
"Houston, TX",Bioinformatics Software Developer,    Genialis,65000.0,"We aim to empower life scientists to engage with their data, and to liberate bioinformaticians from rote service jobs, so both can focus on heavy-hitting..."
"Houston, TX",Flow Cytometry Specialist I,        Baylor College of Medicine,46831.0,One year of flow cytometry experience in a clinical or research flow cytometry laboratory. Acquires and constantly maintains current knowledge of scientific...
"Houston, TX",Quality Assurance Analyst (Research),        Baylor College of Medicine,43794.0,"The QA analyst will report to the Director of Project Development and will assist project managers in sample tracking, data quality control screening and..."
"Houston, TX",Research Scientist,        Rice University,59950.0,"Various fields in science and engineering, including but not limited to materials science, physics, applied physics, chemical engineering, mechanical..."
"Houston, TX 77058 (Pasadena area)",Postdoctoral Fellow Bioinformatics,        Texas A&M University,65000.0,The Institute off Biosciences and Technology (IBT) at Texas A&M University Health Science Center is an internationally recognized leader in biomedical and...
"Houston, TX",Research Statistical Analyst -Bioinformatics & Computational...,        MD Anderson Cancer Center,83000.0,"The primary purpose of the Research Statistical Analyst position is to c arry out data preparation responsibilities related to cancer clinical trials, develop..."
"Houston, TX",Staff Scientist (Biocurator I),        Baylor College of Medicine,60000.0,These positions represent ideal opportunities for individuals wishing to developer a career path away from the bench in the emerging area of biomedical data...
"Dallas, TX",Sr Software Engineer II,        Altair Engineering,102000.0,"Altair ProductDesign is a global, multi-disciplinary product development consultancy of more than 700 designers, engineers, scientists, and creative thinkers...."
"Dallas, TX",Senior Statistician,    Harnham,105000.0,"Experience using a wide range of Analytics tools is desirable (, SAS, SQL, R, Python etc.). The successful Senior Statistician can expect a salary of $100,000 -..."
"Richardson, TX",Research Associate,        University of Texas at Dallas,50000.0,"Qualified individuals must have training and experience in research in developmental or child clinical psychology, excellent writing skills, strong expertise in..."
"Dallas, TX 75201 (City Center District area)",Senior Principal Data Scientist,    Lawrence Harvey,190000.0,"Candidates and 7 years for Masters candidatesMinimum 5 years of work experience in relevant domains (Energy, Oil & Gas, Chemicals, Natural Resources, Mining &..."
"Dallas, TX",Certifying Scientist,    Lighthouse Recruiting,72500.0,"Join our Medical Laboratory Scientists Groups:. The Laboratorian features a list of open clinical lab jobs, the latest industry news, salary information,..."
"Irving, TX 75038",RISK ANALYST - statistical modeling / SAS,        Cottonwood Financial,57150.0,KEY RESPONSIBILITIES Develop and implement effective scoring models to be used in decisioning across all aspects of the customer lifecycle Work closely with...
"Seattle, WA",Data Scientist,    NxT Level,142500.0,"We are looking for a passionate Data Scientists that are looking to deep dive into a Seattle, WA company that's growing exponentially...."
"Bellevue, WA",Data Engineer/Scientist,    Employment Trust,117500.0,"Unlock insights from consumer, commerce, and logistics datasets with math/statistical modeling, machine learning, data mining, econometrics to help understand..."
"Seattle, WA",Software Engineer - Machine Learning,    NxT Level,171000.0,
"Bellevue, WA 98004 (Downtown area)",Internet Research Analyst,"    G2 Web Services, LLC",35000.0,"Please include ""Internet Research” and your name in subject line of your response. As a progressive employer, we offer a competitive salary with a complete..."
"Seattle, WA",Senior Data Scientist,        Smith Hanley Associates,160000.0,"Senior Data Scientist. Deep learning, graphical modeling, NLP, learning to rank, data mining and web mining. You will be given flexibility to pursue interesting..."
"Seattle, WA",Business Intelligence Scientist,    All-In Analytics,125000.0,"SQL, Digital Analytics, eCommerce, Big Data, A/B Testing, data mining, data analysis, reporting, dashboarding, product management, program management, agile,..."
"Seattle, WA",Environmental Compliance Coordinator,        King County,93350.0,"FESU is the Division's professional and technical services unit that consists of approximately 30 engineers, architects and scientists that works..."
"Seattle, WA",Associate Analytics Analyst - Liberty Mutual Surety,        Liberty Mutual,59500.0,"Opportunities to advance through Advanced Analytics and Data Scientist career tracks. In this entry-level role, you will work on our new Surety Analytics team,..."
"Seattle, WA 98101 (Downtown area)",Predoctoral Research Fellow,        Seattle Children's Hospital,45850.0,"The fellow will be mentored by the program director, a computer scientist and developmental researcher, and involved in an active community of clinical and..."
"Seattle, WA",Sr. Global Device Manager,    All-In Analytics,162500.0,"Working with a team of Analysts, Software Developers, Data scientists, and Product Managers. Sr...."
"Boulder, CO","Head, Jerry Crail Johnson Earth Sciences & Map Library",        University of Colorado,65000.0,
"Phoenix, AZ","Clinical/Research Nurse, OB/GYN (Phoenix, AZ)",        The University of Arizona,70000.0,
"Minneapolis, MN",Digital Marketing (Data Scientist),"    Kennedy Unlimited Inc, Professional Staffing",115000.0,"Use your current research and analysis skills to apply various statistical and machine learning techniques, to develop predictive models, experimental designs,..."
"Minneapolis, MN 55439",BI Architect / Data Architect / Data Scientist - blend | Con...,    RED SKY Consulting,120000.0,"Data Architect, BI Architect, Data Scientist, Data Architect, Data Scientist, BI Architect, business intelligence architect, ETL developers, marketing, Customer..."
"Saint Paul, MN",User Interface and Data Manager,    Monarch Joint Venture,58700.0,"Guidelines for data sharing, 2) recommendations for creating a centralized database that can meet national and tri-national needs for housing and sharing data,..."
"Minneapolis-Saint Paul, MN",Division Administrative Support-Oral and Maxillofacial Surge...,        University of Minnesota,43794.5,"Experience working with confidential data (student, health records or financial data). Manage faculty academic and professional calendars and manage conference..."
"Miami, FL",Machine Learning Engineer,        CTI Consulting,120000.0,"Experience applying machine learning techniques to noisy, uncertain and/or dynamic data sets. Design and implementation of machine learning software solutions..."
"Coral Gables, FL",Sr. Research Analyst / Pre-award Grants,        University of Miami,56000.0,"UHealth-University of Miami Health System, South Florida's only university-based health system, provides leading-edge patient care powered by the ground..."
"Miami, FL",Associate Scientist / R&D Division,    Open Scientific,47500.0,Maintain familiarity with current scientific literature and trends. If you are extended a permanent offer the salary could range between $52K to $58K with...
"Coral Gables, FL",Research Associate 1,        University of Miami,46000.0,"UHealth-University of Miami Health System, South Florida's only university-based health system, provides leading-edge patient care powered by the ground..."
"Coral Gables, FL",Sr. Research Analyst,        University of Miami,56000.0,"UHealth-University of Miami Health System, South Florida's only university-based health system, provides leading-edge patient care powered by the ground..."
"Dania Beach, FL",Legal Research Analyst,        Liberty Settlement Funding,30000.0,"Liberty Settlement Funding, a rapidly growing financial service organization, is seeking applicants with an analytical bent for full-time entry level Legal"
"Coral Gables, FL",Research Analyst,        University of Miami,46000.0,Work directly with Principal Investigator and Executive Director of Clinical Research Services to create study specific budgets for all new clinical trials ...
"Coral Gables, FL",Research Analyst (Two open positions),        University of Miami,50000.0,"Experience with data warehousing and reporting tools, Basic Macro, PeopleSoft, ERP and OBIEE systems and/or developing database queries (e.g., SQL)...."
"Coral Gables, FL",Sr. Research Laboratory Technician,        University of Miami,46000.0,"UHealth-University of Miami Health System, South Florida's only university-based health system, provides leading-edge patient care powered by the ground..."
"Coral Gables, FL","Psychiatry- Assistant Scientist, SOM",        University of Miami,75400.0,"UHealth-University of Miami Health System, South Florida's only university-based health system, provides leading-edge patient care powered by the ground..."
"Miami, FL",QC Scientist,    Open Scientific,56500.0,
"Coral Gables, FL",Research Laboratory Technician,        University of Miami,38400.0,"UHealth-University of Miami Health System, South Florida's only university-based health system, provides leading-edge patient care powered by the ground..."
"Charlotte, NC",Digital Marketing (Data Scientist),"    Kennedy Unlimited Inc, Professional Staffing",115000.0,"Use your current research and analysis skills to apply various statistical and machine learning techniques, to develop predictive models, experimental designs,..."
"Charlotte, NC 28277 (Piper Glen Estates area)",Data Scientist,"    Syntelli Solutions, Inc",120000.0,2+ years as Senior/Lead Data Scientist. Lead role in our very fast growing Data Science team from marketing analytics perspective....
"Charlotte, NC 28202 (Downtown Charlotte area)",Marketing Analytic Consultant,        Principle Solutions Group,105000.0,"Marketing Analyst, Data Scientist, Quantitative Analyst, SAS, R, CRM, SQL, market segmentation, data trends, visualization techniques, algorithm...."
"Charlotte, NC",Full Time Bioinformatics Software Developer,        UNC Charlotte,65000.0,"With a major NSF grant recently awarded, Pathview will be fully developed as a systematic solution for pathway based analytics and visualization...."
"Charlotte, NC",Analytics Manager (Machine Learning),"    Kennedy Unlimited Inc, Professional Staffing",135000.0,"Strong recent projects involving programming in SAS, R and Machine Learning algorithms. Fill Key job opening in Analytics Manager (Machine Learning)...."
"Charlotte, NC 28202 (Downtown Charlotte area)",Database Analyst,        Principle Solutions Group,70000.0,"Interest in Big Data Development, Data Analytics, Data Scientist. Our industry leading client is looking to build out a new Data and Analytics Solutions team..."
"Nashville, TN",Statistician,"    CES, LLC",66500.0,"Demonstrated experience and knowledge of health care information (health claims data specifically Medicare and Medicaid, ICD-9-CM codes, physician specialty..."
"Brentwood, TN","PhD Laboratory Director, Toxicology and Pharmacogenetics",    Lighthouse Recruiting,112500.0,This lab operation is looking to bring on a Lab Director to manage clinical toxicology and PGX. This is an ideal role for an experienced lab manager who is...
"Kansas City, MO 64111 (Valentine area)",Community Connections Projects Manager,        Cornerstones of Care,47500.0,Creating Community Solutions-KC (CCS-KC) brought more than 300 participants together at an action-planning session in 2013 where young adults said life-skills...
"Columbus, OH",Statistical Analyst,    National Career Group,65000.0,"Proficient in data analytics function, pivot tables, v-lookup formulas, and name manager functions. Participate in planning and execution of departmental..."
"Franklin County, OH",Assessment Research Analyst,    State of Ohio Jobs,65468.0,Collects data and analyzes data with statistical analysis software; Data resource allocation process; Is your strength data analysis?...
"Columbus, OH 43203 (Near East area)","Director, Data Analysis & Compliance",        Columbus Urban League,61000.0,"Process and monitor agency data reports to ensure the accuracy of agency outcomes. Director, Data Analysis & Compliance...."
"Columbus, OH",Data Scientist,    Harnham,130000.0,An opportunity for technical data scientists to join an innovative boutique consultancy to support the surge in demand of new data science projects on behalf of...
"Columbus, OH",Post Doctoral Researcher,        The Ohio State University,50250.0,"In a relevant field such as genetic epidemiology, statistical genetics, biostatistics or bioinformatics is required...."
"Franklin County, OH",Assessment Research Analyst,        State of Ohio,65468.0,Collects data and analyzes data with statistical analysis software; Data resource allocation process; Is your strength data analysis?...
"Columbus, OH",Director-00,        The Ohio State University,112500.0,"With 38 departments, 20+ world-class research centers, and more than 2,000 faculty and staff members, our students, undergraduate and graduate, have the unique..."
"Columbus, OH",Statistical Business Analyst,    National Career Group,65000.0,"Will also act as a liaison between engineering managers, senior managers, division directors, and department management in budget and business activities to..."
"New York, NY 10005 (Financial District area)",Real World Evidence Statistical Analyst,        Barrington James,110000.0,
"New York, NY",Data Scientist,        Smith Hanley Associates,90000.0,"Additional responsibilities will include data and text mining using large and complex data sets, both financial and non-financial related...."
"Manhattan, NY",Hydrologist,    DEPT OF PARKS & RECREATION,78000.0,"For Assignment Level I (only physical, biological and environmental sciences and public health) A master's degree from an accredited college or university with..."
"New York, NY",Sr Data Scientist - NLP & CODING REQUIRED,    PMES,155000.0,"Data manipulation and analysis using SQL, noSQL, Java, C, SAS, and machine learning suites such as Mahout, Weka, and RapidMiner:...."
"Manhattan, NY","Panel Maintenance Analyst, World Trade Center Health Registr...",        DEPT OF HEALTH/MENTAL HYGIENE,65977.0,The World Trade Center Health Registry (WTCHR) was developed as a public health response to document and evaluate the physical and mental health impact of the...
"New York, NY",NLP Scientist-R&D,        WSI Nationwide,140000.0,"If you know someone who might qualify, Please don't call to ask if there any exceptions, there aren't), e-mail a Word or RTF resume with contact information,..."
"New York, NY","Manager, Client Strategy",    DemystData,92500.0,"Experience in data analytics, statistics, or R programming preferred. We are a collection of engineers, data scientists and industry experts...."
"New York, NY 10016 (Gramercy area)",Marketing Research Analyst/Consumer Insights Analyst,        The Forum Group,55000.0,"Involved in all aspects of project management life cycle including writing screeners, questionnaire design, developing tab and banner plans, testing survey..."
"Manhattan, NY",Field Scientist,    DEPT OF PARKS & RECREATION,62693.0,
"Paramus, NJ",Analytics Manager,        Smith Hanley Associates,140000.0,
"Manhattan, NY",Overdose Prevention Coordinator,        DEPT. OF HOMELESS SERVICES,83421.5,"Perform data collection and track and analyze naloxone distribution data and overdose reversal reports, create and manage reports, prepare quarterly Intranasal..."
"New York, NY",Manager - Predictive Modeling,        Oliver James Associates,170000.0,
"New York, NY 10010 (Gramercy area)",Innovative Ad-Tech Company Seeks a Senior Fullstack Javascri...,        Jobspring Partners,145000.0,"You’ll work closely with multiple Front End Engineers, a Data Scientist, a Backend Engineer, Interactive Designers, and an Art Director...."
"New York, NY",Equity Research Analyst,        Execu | Search,85000.0,"Evaluate current and long-term trends across several industries. Execute in-depth industry analysis using resources such as market data, economic news and..."
"New York, NY",Policy Analyst,    DEPT OF ENVIRONMENT PROTECTION,65977.0,"For Assignment Level I (only physical, biological and environmental sciences and public health) A master's degree from an accredited college or university with..."
"Chicago, IL",Data Engineer,    Enodo Score,80000.0,"Working and communicating effectively with an interdisciplinary team of data scientists, software engineers and real estate industry experts...."
"Chicago, IL",Data Scientist,        Huxley Associates,100000.0,The Data Scientist will be involved with business critical projects and will be working with brand new technology while using machine learning techniques....
"Chicago, IL","Analyst/Senior Analyst, Advanced Analytics",        Liberty Mutual,94100.0,"Participate in discussions with key stakeholders, such as Underwriting, and GS Analytics modeling team consisting of data scientists to support development of..."
"Chicago, IL",Data Scientist,        Jobspring Partners,130000.0,"The role will allow you take ownership of your work, and continuously learn from intelligent and hard-working data scientists...."
"Chicago, IL",Data Scientist -Fitness/Wellness Firm,    Hirewell,120000.0,"Expertise in text mining, NLP methods, information extraction and/or machine learning. Bring structure to large quantities of data - turn unstructured data into..."
"Chicago, IL","Data Scientist (Python, Spark, AWS)",        Workbridge Associates,92500.0,A digital marketing firm located in River North is looking for a Data Scientist to join their growing analytics team....
"Evanston, IL",Data Scientist,    Hirewell,150000.0,"Contribute to implementing our distributed data and analytics platform in an elastic fashion. Data skills, whether relating to data size, speed requirements,..."
"Chicago, IL","Lead Data Scientist (Tableau, RShiny, D3)",        Workbridge Associates,130000.0,"The ideal candidate will have a strong sense of predictive modeling or machine learning experience and has been hands on using Python, R, Hadoop, Spark, and..."
"Chicago, IL",Quantitative Analyst,    Huxley Banking & Financial Services,100000.0,"This Chicago based position is for an Investment Analyst with a focus on OTC Derivatives within the UMR Group, reporting to the VP of Quantitative Analytics...."
"Chicago, IL",Machine Learning Engineer,        Jobspring Partners,135000.0,"Currently, they are seeking a Machine Learning Engineer who has experience with Python, Computer Vision/Deep Learning, and ElasticSearch...."
"Chicago, IL",Quantitative Risk Analyst,    Huxley Banking & Financial Services,90000.0,"Strong technical skills in VBA, Python, and SQL. Do you love working on a variety of projects that involve complex modeling methods and exciting technology?..."
