location,title,company,salary,summary
"Chicago, IL",Data Scientist (Machine Learning),        Workbridge Associates,130000.0,A fast growing data analytics consulting shop is looking expand the development team by adding a Data Scientist in their Chicago office....
"Chicago, IL 60603 (Loop area)",Lead Data Scientist,        Jobspring Partners,150000.0,Join one of America’s leaders in providing health benefits as a Lead Data Scientist. This opportunity will allow you to lead the development of Machine Learning...
"Chicago, IL",Lead Data Scientist (NLP),        Workbridge Associates,135000.0,"The ideal candidate will have strong machine learning, data mining, and natural language processing experience...."
"Chicago, IL",Open Source Geniuses,    Hirewell,120000.0,"As a Software Engineer, you will join our Chicago-based technology team, working collaboratively with other engineers, analysts, and data scientists to serve..."
"Chicago, IL 60603 (Loop area)",CTO,        Workbridge Associates,120000.0,A rare opportunity has opened up within Chicago’s machine learning market! Interest in Data Science is a huge plus....
"Chicago, IL",Research Analyst-Clearing House,    Huxley Banking & Financial Services,90000.0,"Research Analyst-Top Clearing House My client, a high end Clearing Firm is looking to hire a Research Analyst to join their team. The Research Analyst will"
"Chicago, IL",Lead Data Scientist,    Harnham,250000.0,"Their team of engineers, data scientists and domain experts employ advanced technologies to run computational analytics, build representational models and..."
"Chicago, IL",Research Analyst-Clearing House,        Huxley Associates,90000.0,
"Downers Grove, IL",Sr. Machine Learning Developer,    All-In Analytics,75000.0,
"Chicago, IL 60603 (Loop area)",Full Stack Developer,        Workbridge Associates,90000.0,A rare opportunity has opened up within Chicago’s machine learning market! Interest in Data Science is a huge plus....
"Chicago, IL","Predictive Modeling, Director",        Analytic Recruiting,125000.0,"Analytics, SAS, R, SPSS, Marketing Analytics, Modeling, Statistics, Predictive, marketing mix, media. Crafting the methodology, to data modeling using tools..."
"Chicago, IL",Environmental Soil Scientist,        Metropolitan Water Reclamation District of Greater...,95932.5,"Appointment is subject to successfully passing a physical examination, a drug test, and a criminal history background investigation...."
"Chicago, IL",Senior Statistical Analyst,        Smith Hanley Associates,85000.0,"Experience with web analytics tools such as Adobe Analytics, Google Analytics, WebTrends a plus. Experience in modeling, forecasting, segmentation and data..."
"Chicago, IL 60604 (Loop area)",Principal Machine Learning Engineer,        Jobspring Partners,160000.0,4+ years experience with data analytics. We are looking to bring on a Principal Data Scientist to join our growing data engineering team in the Loop....
"Rosemont, IL",Statistical Analyst,        Smith Hanley Associates,75000.0,Smith Hanley Associates is the premier recruiting agency serving the analytics and data science industry. Experience in R a plus....
"Chicago, IL",Study Based Research Position in the State of Road Island &...,    RASS BIOSOLUTION PVT LTD,60000.0,_ Research Scientist*. _ Pharma / Biotech / Clinical Research*. The candidate will have to compile the report and data on a real time basis to produce the...
"Chicago, IL",Senior Statistical Modeler,        Smith Hanley Associates,85000.0,Smith Hanley Associates is the premier recruiting agency serving the analytics and data science space. -Ability to manipulate complex data sets and communicate...
"San Francisco, CA",Jr. Customer Success Manager,    Smarking,55000.0,"As an early member of our team, you’ll work to serve as a trusted point of contact for Smarking customers, from the point of sale through on boarding, project..."
"San Francisco, CA",Sr. Customer Success Manager,    Smarking,80000.0,"Smarking is a group of driven data scientists, MIT PhDs, engineers, transportation nerds, and business professionals working to introduce elegant solutions to..."
"Santa Clara, CA","Principal Software Engineer, Data Science",    MatchPointe Group,125000.0,"Scientific Programming experience with Python – Numpy / Pandas / SciKitlearn / Matplotlib. Principal Software Engineer, Data Science...."
"Santa Clara, CA","Principle Scientist, Data Science, System integration",    MatchPointe Group,125000.0,"Principal Scientist, Data Science, System Integration. Develop a Bio-Physics understanding of the root mechanisms behind the data analysis...."
"San Jose, CA 95113 (Downtown area)",Senior Machine Learning Data Scientist,        Workbridge Associates,150000.0,Leading provider of mortgage software solutions has founded a new high-visibility Data Engineering & Machine Learning organization and is seeking Data...
"Mountain View, CA 94039",Senior Data Scientist,        Workbridge Associates,200000.0,"A fast paced startup in Mountain View is taking on social media marketing and looking for a Senior Data scientist to join their ranks, can pay up to $200k...."
"Mountain View, CA 94043",Big Data Engineer,        Jobspring Partners,170000.0,"Drawing on your depth of knowledge of the Hadoop ecosystem and data analytics you’ll be responsible for solving challenging real-life, customer use cases in..."
"San Jose, CA 95113 (Downtown area)",Machine Learning Engineer - Computer Vision,        Jobspring Partners,190000.0,"Experience with robotics, machine learning, visual recognition, UAVs a plus. Competitive salary, equity, paid time off, medical, dental and vision benefits,..."
"San Diego, CA 92122","Staff Product Manager, Compliance Testing – Consumer Electro...",        Tristaff Group,127500.0,"Principal Technical Product Manager, DRM, digital rights management, streaming video, media, game consoles, gaming, blueray, , open source, User Interface, ,..."
"Los Angeles, CA",Research Analyst - Legal,    Fawkes IDM,77500.0,"Performing legal, business and scientific reference and research using a variety of free and fee-based databases and websites...."
"Los Angeles, CA",scientist,    Liberos LLC,50000.0,"Screen/Store/Transmit psychophysiological data. Scientific publications, esp neuroscience journals. Experience applying psychophysiological sensors...."
"Los Angeles, CA",Computer Vision Data Scientist,    MACP Los Angeles,185000.0,We are looking for a Senior Data Scientist with experience applying state of the art machine learning algorithms to massive data sets.Some of the projects that...
"Los Angeles, CA","MEDICAL TECHNOLOGIST, DATA SYSTEMS",        Los Angeles County Department of Human Resources,88765.0,"Clinical Laboratory Scientist, Limited Clinical Laboratory Scientist, Clinical Microbiologist Scientist License, or Public Health Microbiologist Certificate..."
"Los Angeles, CA","RESEARCH ANALYST III, BEHAVIORAL SCIENCES",        Los Angeles County Department of Human Resources,79758.5,Until the needs of the service are met and is subject to closure without prior notice. DEPARTMENT OF HEALTH SERVICES....
"Los Angeles, CA",Principal Data Scientist,    Harnham,160000.0,Principal Data Scientist. YOUR ROLE AS PRINCIPAL DATA SCIENTIST. Initially the role holder will be an individual contributor but the position does have the...
"Northridge, CA 91324",Research Scientist,        Arete Associates,104500.0,"Sensor applications including EO/IR and radar, data analysis, signal processing, machine learning, algorithm development...."
"Los Angeles, CA",Data Entry & Analysis Specialist,    FullDeck,37500.0,"This person will work autonomously in a very collaborative team environment alongside Data Scientists, Engineers, and Media colleagues and will take complete..."
"Los Angeles, CA",Senior Backend Data Engineer,        LT,190000.0,Our data team consists of three data analysts and three data scientists. Develop highly scalable realtime data pipelines to power data driven products and...
"Los Angeles, CA",Java Engineer,        LT,190000.0,Our data team consists of three data analysts and three data scientists. Your insurance benefits are all top of the line including 100% employer paid health...
"Los Angeles, CA",Lead Android Developer,        LT,200000.0,Our data team consists of two data analysts and two data scientists. Your benefits are all top of the line including 100% employer paid health insurance with...
"Los Angeles, CA",Property and Casualty Predictive Modeler #74851,    Ezra Penland Actuarial Recruitment,160000.0,"Client prefers this data scientist to have 8 to 15 years of experience, approximately. Must have experience with advanced statistical analysis of insurance..."
"Pasadena, CA",LC/MS Clinical Laboratory Scientist,    Lighthouse Recruiting,95000.0,Established and expanding clinical toxicology laboratory seeking to add an experienced LC/MS Clinical Laboratory Scientist to their team....
"Los Angeles, CA",Ad Operations Manager,        LT,87500.0,"There is currently three Data Scientists. Data Science is using R, Hadoop, Spark, Python and more. Oversee daily reporting and regularly manage A/B tests,..."
"Santa Monica, CA",Data Scientist,    Workpop,80000.0,"As a data scientist on our fast-moving team, you will be involved in every aspect of growing Workpop as a data-oriented business...."
"Washington, DC",SVP Big Data and Analytics,    Harnham,250000.0,"Client Solutions, Predictive Analytics, Big Data, Marketing, Customer Insight, Optimization, ROI, Consultancy, SAS, SQL, Machine Learning, Solutions Architect,..."
"Washington, DC","Senior Software Engineer (Data Engineer, IoT)",        Jobspring Partners,135000.0,"IoT, Big Data, Java, Scala, Python, Analytics, Sensor, Machine Learning, Spark, Accumulo, Kafka, RabbitMQ, ETL, NoSQL, Storm, Data Scientist, Github...."
"Somerville, MA",Technical Data Analyst,    Sharp Action LLC,72500.0,Put data models (from data scientist) into production. Automate data scrubbing for machine learning model input....
"Boston, MA",Data Visualization Research Specialist,    Northeastern University - Network Science Institut...,50000.0,Must be able to contribute to an interdisciplinary research initiative using strong project management and communication skills working closely with its...
"Boston, MA",Machine Learning Engineer,        Darwin Recruitment,175000.0,"Apply machine learning, NLP and deep learning methods to huge data sets. Natural language processing, machine learning, machine vision, collaborative filtering,..."
"Boston, MA","Director II, Applied Science, Solaria Labs",        Liberty Mutual,163200.0,"Job Responsibilities Manage and develop a multi-disciplinary team of applied scientists. In parallel, advise 3-5 other Solaria Labs teams on how to use..."
"Boston, MA",Sr. Quantitative Analyst,        Huxley Associates,200000.0,"ClariFi, Excel, R, Matlab or SQL. The Analyst will focus on Equity research across a number of key initiatives and provide investment insights through the use..."
"Boston, MA",Quantitative Data Scientist,        Huxley Associates,175000.0,"Extensive experience (7+ years) with big data, analytics, machine learning, and modeling. Responsibilities of senior data scientist:...."
"Cambridge, MA","Scientific Director, Oncology/ RNA Diagnostics",    TEC Group International,175000.0,"Deep technical understanding of relevant technologies for sample extraction, target amplification, multiplex assay, qPCR, next generation sequencing detection..."
"Boston, MA",Machine Learning Engineer,        Workbridge Associates,125000.0,They also host machine learning seminars each week to allow for a collaborative and learning work environment....
"Boston, MA",Senior Data Scientist,        Huxley Associates,140000.0,A Global Insurance provider is looking for a Senior Data Scientist to join their growing Data Analytics group....
"Boston, MA 02116 (South End area)",Machine Learning Engineer,        Jobspring Partners,147500.0,Established software product company located on the North Shore of MA is diving in to the exciting world of Machine Learning....
"Cambridge, MA 02139 (Area IV area)",Senior Research Scientist,        Jobspring Partners,160000.0,"This team is looking for a lead, and two senior data scientists to jump start the deep learning techniques on their team...."
"Boston, MA","Data Scientist - Fintech startup, R, Python, big data",    The Bivium Group,140000.0,"Pattern recognition or machine learning• data mining, manipulation, analysis, charting and other visualization and reporting tools...."
"Marlborough, MA","NLP DATA SCIENTIST, HEALTHCARE ANALYTICS",    Harnham,120000.0,Data Scientist | Natural Language Processing | Statistical Methods | Predictive Analytics | Machine Learning | Advanced....
"Boston, MA",Sr. Data Architect,    All-In Analytics,190000.0,"The dashboards will be internationalized and used by our data associates, research scientists, and managers around the world...."
"Watertown, MA 02472",Entry Level Analytical Chemist,"    480 Biomedical, Inc.",50000.0,"We are a multi-disciplinary team of biologists, chemists, materials scientists, and engineers, working in close collaboration to understand the biology of..."
"Cambridge, MA 02139 (Area IV area)",Logistics Technician,        Abcam,38500.0,"Abcam Logistics is focused on providing the world’s best research tools to scientists everywhere, helping them achieve their mission, faster...."
"Boston, MA",SQL*Server Database Developer,"    Horizons Recruitment, Inc.",145000.0,We're looking for a software engineer with deep knowledge of the Microsoft platform and strong ETL development experience to join a small team of computer...
"Boston, MA",Market Research Analyst,    AP Staffing,36000.0,Ability to maintain attention to detail while accurately interpreting source data. Experience in a data driven or research based role using primary and...
"Boston, MA",Biostatisticians / Boston / Precision Medicine,    Invenia Resourcing,120000.0,
"Boston, MA",Clinical Laboratory Surveyor,        Commonwealth of Massachusetts,73570.5,"The mission of the Massachusetts Department of Public Health (DPH) is to prevent illness, injury, and premature death, to assure access to high quality public..."
"Cambridge, MA",Cognitive / AI Data Scientist,    AA Search,160000.0,"Master’s degree or Ph.D in Computer Science, Applied Statistics, Engineering, Mathematics, Physics or other qualitative discipline with specialization and..."
"Boston, MA 02108 (Back Bay-Beacon Hill area)",Data Scientist,    Corporate Consulting Services,140000.0,"Python, R, machine learning, natural language processing, business intelligence tools, online marketing analytics tools, advanced Microsoft Excel.• Expertise in..."
"Maynard, MA",Laboratory Technician I - Forensic Biology,        Commonwealth of Massachusetts,42421.5,
"Quincy, MA",E-mail Marketing Rockstar - Manager,    IntelyCare,70000.0,"Team player, comfortable working with design/UX, engineers, data scientists, and product managers. Create and execute test plans around subject lines, timing,..."
"Pittsburgh, PA",Laboratory Technician,        The University of Pittsburgh,30810.0,The main task will be to assist scientists conducting their experiments in cellular and molecular immunology. Procedures also include handling of nucleic acids...
"Philadelphia, PA",Program Manager - Data Analysis/Insider Threat,    Pamir Consulting,85000.0,"Serve as global subject matter expert for Intellectual Property & Trades Secret Protection event and data management system, and provide guidance and assistance..."
"Cherry Hill, NJ",Scientist,    HumanEdge,97500.0,"Utilize advanced chemical knowledge, data, modeling and statistical tools to solve technical challenges. This full-time position offers excellent benefits,..."
"Atlanta, GA",Laboratory Aide 3,        Georgia Department of Public Health,24000.0,"Under broad supervision, assists technicians and laboratory scientists with data or specimen collection and laboratory procedures...."
"Roswell, GA",Real Estate Research Analyst,    Jumpvine,55000.0,"Are you naturally organized and detailed oriented and enjoy solving problems?If the above sounds like you, then our client,a well-established claims management..."
"Creve Coeur, MO",Applied Statistician,"        Advance Services, Inc.",65000.0,"A solid knowledge base in applied statistics, data interrogation and modeling is required. Analyzes and interprets data from various sources...."
"St. Louis, MO",Data Scientist/Predictive Modeler -- Life/Health-7658,    S.C. International,125000.0,"Qualified candidates should possess an advanced skill set with some combination of SAS, R, Python, MATLAB, SQL, VBA, etc. Actuaries with prior experience in..."
"St. Louis, MO",Statistical Data Analyst - Pathology & Immunology,        Washington University in St. Louis,52566.5,SAS experience and proficiency with data analysis and/or data management. Performs data querying and management and/or data analysis for investigators using...
"St. Louis, MO","Director, Data Analysis",    The McManness Group,140000.0,"Develop and champion adoption of population health analytics programs, including affordability, quality and health outcomes...."
"St. Louis, MO",Clinical Research Data Analyst - Pediatrics Computing Facili...,        Washington University in St. Louis,61183.0,"Serves as a resource to provide faculty and clinical research staff with full-service comprehensive data query and analysis, using new or existing clinical..."
"St. Louis, MO",Clinical Informaticist I - Siteman Cancer Center,        Washington University in St. Louis,54963.5,"Requires a Bachelor's degree in computer science, informatics, or health science field and up to two years of related clinical or research experience...."
"St. Louis, MO",Staff Scientist - The Genome Institute,        Washington University in St. Louis,54095.5,"Development and implementation of flexible systems for storage and access of large phenotypic and genetic data sets, and extensive interaction with internal and..."
"St. Louis, MO",Staff Scientist - Radiology,        Washington University in St. Louis,52842.0,"Ability to analyze and interpret statistical data and to communicate data in a clear, concise manner. Performs complex statistical analysis of data collected..."
"St. Louis, MO",Research Scientist I,        Washington University in St. Louis,54095.5,"Ability to analyze and interpret statistical data and to communicate data in a clear, concise manner. Conducts literature searches related to research project...."
"St. Louis, MO",Staff Scientist - Biochemistry & Molec Biophysic,        Washington University in St. Louis,54095.5,Performs complex statistical analysis of data collected and writes interpretative reports. Conducts literature searches related to research project....
"St. Louis, MO",Staff Scientist - Biochemistry & Molecular Biophysics,        Washington University in St. Louis,54095.5,"Ability to analyze and interpret experimental data and to communicate data in a clear, concise manner. Computer literacy including the ability to use a variety..."
"St. Louis, MO",Staff Scientist - Developmental Biology,        Washington University in St. Louis,52842.0,Performs complex statistical analysis of data collected and writes interpretative reports. Conducts literature searches related to research project....
"Berkeley, CA 94705",Sr Data Scientist/Solution Architect,    Redfish Technology,250000.0,"As a Solution Architect, you are responsible for leading a team consisting of highly skilled data engineers, data scientists, and/or data strategists to design..."
"Houston, TX","Sr Data Scientist (Hadoop) - Duluth, Georgia","    Horn Solutions, Inc.",105000.0,Clearly communicate the business and technical benefits of analytics and visualization to both business and technical audiences....
"Dallas, TX","Senior Analyst, Supply Chain Analytics",        Smith Hanley Associates,90000.0,"Senior Data Scientist. -Perform data mining and develop insights that will drive decision making. -Proficiency using big data tools (such as R, Python, Spark..."
"Seattle, WA",Software Engineer - Machine Learning,    NxT Level,117500.0,"MS or PhD degree in Computer Science, Artificial Intelligence, Machine Learning, or related technical field. Exceptional project management skills...."
"Seattle, WA",Software Development Engineer (Back End),    Laetus Recruitment,135000.0,
"Seattle, WA",Bioinformatics Analyst,    Lighthouse Recruiting,85000.0,
"Seattle, WA",Variant Scientist (Remote),    Lighthouse Recruiting,95000.0,We are currently seeking a Variant Scientist for an exciting opportunity to be part of a new molecular clinical laboratory that will be performing Next...
"Portland, OR",Digital Marketing (Data Scientist),"    Kennedy Unlimited Inc, Professional Staffing",115000.0,"Use your current research and analysis skills to apply various statistical and machine learning techniques, to develop predictive models, experimental designs,..."
"Portland, OR","Data Scientist - Machine Learning, NLP",        WSI Nationwide,142500.0,"Our Data Scientists design, develop, and implement data-driven solutions using machine learning technologies and advanced statistical analyses...."
"Portland, OR",Post Doctoral Scholar,        Oregon Health & Science University,47484.0,Experience with data management. Oregon Health & Science University values a diverse and culturally competent workforce....
"Beaverton, OR 97006 (Triple Creek area)",Corporate Account Manager,    Acumen Executive Search,100000.0,"Account Management, Account Manager, Customer Service, OEM, BioTech, Medical device, sales, business development, CRM, Customer Support, sales forecasting,..."
"Portland, OR",Postdoctoral Fellow,        Oregon Health & Science University,43692.0,
"Portland, OR",Director Data Science,        WSI Nationwide,170000.0,"The selected Director of Data Science candidate will attract, build and lead a team of data scientists, Business Intelligence professionals, analysts and..."
"Denver, CO","SENIOR RESEARCH ANALYST, PORTALS",        Denver Public Schools,69673.0,"Facilitate data loading and validation of district data into portals. Work frequently includes writing queries to pull data, overseeing loading, validation, and..."
"Denver, CO 80216 (Northern Denver area)",Senior Statistical Researcher - Sheriff Department,        City and County of Denver,71671.5,"Performance of professional-level data analysis to evaluate trends and pattern-based, recurring and predictive analysis support...."
"Denver, CO 80204 (Central West Denver area)",SR RESEARCH ANALYST - 17096,        Denver Public Schools,69673.0,"Previous project management experience preferred. Support Research & Evaluation team with annual assessment releases, data requests, and development and..."
"Boulder, CO 80301",Postdoctoral Research Associate,    Space Science Institute,60000.0,
"Denver, CO 80237 (Southeastern Denver area)",Lead Data Scientist,        Edgelink,135000.0,"Big Data Experience. Develop data pipeline to acquire test data for use in model testing. Ideally, proficient with R or Julia and Python (should at least be..."
"Denver, CO",Manager of FP&A,"    Community Investors, Inc.",50000.0,"If you think you might not have all of the requisite data scientist skills, don’t sweat it. CII’s solutions enable its customers to streamline operations,..."
"Phoenix, AZ",Data Architect,        Career Evolutions,150000.0,"As member of the CIO Office, you will ensure that the Corporate Data Platform fulfills the needs of data scientists, developers, and business analysts from the..."
"Phoenix, AZ",Digital Marketing (Data Scientist),"    Kennedy Unlimited Inc, Professional Staffing",115000.0,"Use your current research and analysis skills to apply various statistical and machine learning techniques, to develop predictive models, experimental designs,..."
"Phoenix, AZ",RESEARCH AND STATISTICAL ANALYST,        Arizona Health Care Cost Containment System,47741.5,And conducts data analysis. The Division of Health Care Management (DHCM) is looking for a highly motivated individual to join our team as a Research and...
"Phoenix, AZ",AIR QUALITY PLANNER 2-3,        State of Arizona,61000.0,"The Air Quality State Implementation Plan ESS 3 position is responsible for drafting complex State Implementation Plans (SIPs), including pollutant-specific..."
"Gilbert, AZ 85295",Paralegal,"    Emord & Associates, P.C.",50000.0,"Conduct research on relevant laws, regulations, legal decisions, and scientific issues. Health care providers;..."
"Goodyear, AZ",Budget & Research Analyst,"    City of Goodyear, AZ",79126.5,"Serve as the budget office subject matter expert and liaison for Priority Based Budgeting, Performance measures and/or other standing or ad hoc committees or..."
"Phoenix, AZ",COMPLIANCE OFFICER - HAZ WASTE,        State of Arizona,55750.0,And serves as a subject matter expert supporting the manager by performing review of work of lower level scientist and peer review....
"Phoenix, AZ",ENVIRONMENTAL SCIENTIST - EMISSIONS,        State of Arizona,55000.0,"The Air Quality Emissions ESS 3 position is responsible for managing the rule writing process including writing rules, synthesizing information provided by the..."
"Phoenix, AZ",RESEARCH & STATISTICS ANALYST,        State of Arizona,37500.0,The work product consists of accurate and timely completion of inputting data to identify project trends; ADEQ administers a variety of programs to improve the...
"Scottsdale, AZ",Web Security Research Analyst,        SiteLock,52500.0,Educate customers by writing timely blog posts on the latest malware and security trends. Comfortable with the Linux command line and regular expressions....
