location,title,company,salary,summary
"San Francisco, CA",Senior Safety Scientist,    Das Consulting,225000.0,"Prior industry experience in drug safety, clinical development or medical affairs is desirable MD candidates - clinical practice experience (at least 3 years..."
"San Francisco, CA",Analytics Manager (Machine Learning),"    Kennedy Unlimited Inc, Professional Staffing",135000.0,"Strong recent projects involving programming in SAS, R and Machine Learning algorithms. Fill Key job opening in Analytics Manager (Machine Learning)...."
"San Mateo, CA",Planning and Research Analyst (HSI-Grant Funded),        San Mateo County Community College District,97116.0,"Optional tax-deferred 403(b) and 457 retirement plans are also available. Uses software packages to retrieve, edit, and tabulate data from various databases and..."
"San Francisco Bay Area, CA",Algorithm Software Sequencing Scientist,    PLE,135000.0,"That's because you will not only be working with the best scientists in the country, you will also be doing the most exciting work, impacting and changing..."
"Palo Alto, CA",Data Scientist,    Keyo,160000.0,"We’re looking for talented junior and senior data scientists to join our diverse and fast-growing data team. As a data scientist, you’ll build and implement the..."
"Santa Clara, CA",Data Scientist,    ITStaff Technical Resources,102500.0,"Scientific programming experience (Matlab, R, Python, etc.). You must be driven to learn new concepts from chemistry, physics, algorithm development and..."
"Santa Clara, CA 95050","Principal Data Scientist, Sequencing",    Enterprise Select,150000.0,"If you are passionate about machine learning, big data, medical diagnostics and challenging scientific research problems, this is the opportunity of a lifetime!..."
"Pleasanton, CA 94588","Data Scientist II, Sequencing",    Enterprise Select,120000.0,"The successful candidate must be excited about learning new concepts from chemistry, physics, algorithm development and electrical engineering and applying them..."
"San Jose, CA 95113 (Downtown area)",Data Scientist,        Jobspring Partners,160000.0,They are working on a custom analytics platform that gathers your data with publicly available sources to learn all you can about best-fit physicians and...
"Campbell, CA",STAFF DATA SCIENTIST / DEEP LEARNING,    TERADEEP INC.,140000.0,
"San Jose, CA 95113 (Downtown area)",Data Scientist - Growth Team (Healthcare Startup),        Jobspring Partners,155000.0,"Proficient in programming (Python, R, etc.). Deep knowledge in hypothesis testing and statistical inference. You’re accustomed to a data-driven, experimentation..."
"Sunnyvale, CA 94085",Mid-Level Machine Learning Data Scientist,        Workbridge Associates,190000.0,Leading provider of mortgage software solutions has founded a new high-visibility Data Engineering & Machine Learning organization and is seeking Mid-Level Data...
"Sunnyvale, CA 94085",Mid-Level Data Scientist,        Workbridge Associates,100000.0,A world-renowned life insurance company is seeking to build out their Data Analytics team looking for multiple Mid-Level Data Scientists to join the team in...
"Santa Clara, CA",Senior Data Scientist - NLP & Linguistics,    Harnham,155000.0,Senior Data Scientist - NLP & Linguistics. Statistics or Data Visualization experience. YOUR ROLE AS SENIOR DATA SCIENTIST - NLP & LINGUISTICS:....
"San Jose, CA 95113 (Downtown area)",Data Scientist (Finance Company),        Workbridge Associates,190000.0,"Background in Python, R, Machine Learning, Hadoop, Spark and Bayesian modeling. The solution comes pre-loaded with a comprehensive library of banking-specific..."
"San Jose, CA",Senior AI Data Scientist,    3coast,175000.0,"Research industry trends in Big Data, Machine Learning Recommendation and Personalization, Deep Learning, and adopt the latest and greatest within our branch..."
"Santa Clara, CA",Principal Data Scientist,    ITStaff Technical Resources,125000.0,"We’re searching for an individual who’s passionate about machine learning, big data, medical diagnostics and scientific research challenges...."
"Redwood City, CA",Mid-Level NLP Data Scientist,        Workbridge Associates,175000.0,"You will be working on a small team of data scientist to build machine learning algorithms. The company received a recent round of funding, which they are using..."
"San Jose, CA 95113 (Downtown area)",Senior Data Scientist,        Workbridge Associates,180000.0,
"Campbell, CA",Machine Learning / Deep Learning Internship(s),    TERADEEP INC.,60000.0,
"San Jose, CA 95113 (Downtown area)",Data Engineer,        Jobspring Partners,147500.0,"A well-known established company is looking for a Data Scientist and is willing to pay up to $160,000. Competitive Salary DOE, 401k, Benefits, Equity, Paid..."
"San Jose, CA",SENIOR ARTICIAL INTELLIGENCE (AI)/ DATA SCIENTIST,"    TW STAFFING SOLUTIONS,INC",175000.0,"SENIOR DATA SCIENTIST ARTIFICIAL INTELLIGENCE (AI)*. Relocation available to San Jose, California for those with Ph.D.’s in computer science/engineering with..."
"San Jose, CA 95113 (Downtown area)",Machine Learning Infrastructure Engineer,        Jobspring Partners,150000.0,You will play a critical role in building the world's first mainstream solution to machine learning powered by an autonomous distributed system that infers...
"San Jose, CA 95113 (Downtown area)",Machine Learning Engineer/Scientist,        Jobspring Partners,162500.0,With compressive sensing algorithms and deep learning software they have enabled the safest and most reliable full system solution for autonomous vehicles....
"Santa Clara, CA",Bioinformatics Engineer,    ITStaff Technical Resources,120000.0,"Experience with scientific programming (Python, Matlab, R, etc.). Their sequencing platform is a true integrated circuit on standard semiconductor process..."
"Mountain View, CA",Senior Data Engineer / Senior Data Scientist,    Harnham,160000.0,Statistics or Data Visualization experience. Harnham are exclusively partnering with a leading enterprise social listening platform in their search for a Senior...
"San Jose, CA 95113 (Downtown area)",Mid-Level QA Engineer,        Workbridge Associates,100000.0,They will be working collaboratively with a team of multiple developers and data scientists. This Silicon Valley tech giant of financial services is molding the...
"Santa Clara, CA 95054",Data Entry/research analyst,    ESG Consulting Inc,35000.0,
"San Diego, CA",Corporate Engagement Research Analyst,        UC San Diego,56000.0,"Substantial experience developing and maintaining database systems using appropriate software applications in order to conduct data analytics, e.g, perform..."
"San Diego, CA",Lead Statistician (first in-house hire),        Real Staffing,150000.0,Real Staffing is looking for a Clinical Biostatistician to be the first Biostatistics hire for a biotech company in San Diego....
"San Diego, CA 92122","Staff Product Manager, Compliance Testing - Consumer Electro...",        TriStaff Group,145000.0,
"Los Angeles, CA 90036",Data Scientist (Consumer Loans),    Lendmart,55000.0,"Undertaking knowledge discovery and data mining in large transactional datasets. Performing data extraction, transformation and loading from multiple data..."
"Los Angeles, CA",Quantitative Analyst,    Montgomery Assets,97000.0,"Develop analytics libraries used for Montgomery's equity and fixed income risk-management. Must have a Master’s degree in Statistics, Mathematics, Engineering ..."
"Los Angeles, CA",Jr. Data Scientist,    FullDeck,50000.0,"Data Scientist for our client, a fast-growing tech company with high profile entertainment clients! Experience with relational databases, such as MySQL, Oracle,..."
"Beverly Hills, CA",Investigations & Research Analyst,        Gavin de Becker & Associates,42500.0,"Review, identify, and analyze trends and inconsistencies in reporting and research findings. Conduct internet research, as needed, to acquire more information..."
"Torrance, CA","Market Research Analyst, Automotive Electronics",    Parallel Partners,67500.0,"Track industry trends, relevant legislation, and competitor activities as it relates to consumer electronics and safety...."
"Northridge, CA 91324",Computational Scientist,        Arete Associates,84500.0,"Areté has multiple position openings for entry-level to mid-level research scientists and scientific computing specialists at our office in Arlington, Virginia..."
"Los Angeles, CA",SUPERVISING CLINICAL LABORATORY SCIENTIST II,        Los Angeles County Department of Human Resources,92328.0,Assists a supervising laboratory scientist in the operation of a clinical laboratory unit by resolving technical problems and developing recommendations on new...
"Los Angeles, CA",Senior iOS Developer,        LT,170000.0,"There is currently three Data Scientists. Data Science is using R, Hadoop, Spark, Python and more. _Your benefits are all top of the line including 100%..."
"Los Angeles, CA","Sr. Data Scientist Needed for Top LA Start-Up, Huge Opportun...",    ConSol Partners,160000.0,"Leading content discovery platform seeking Senior Data Scientist to join evolving, entrepreneurial Big Data team with their rapidly growing organization...."
"Los Angeles, CA",Senior DevOps Engineer,        LT,190000.0,"Our data team consists of three data analysts and three data scientists. Finally you will apply your deep knowledge of monitoring tools, and NOC operations to..."
"Washington, DC",Data Scientist (Math background),        Jobspring Partners,200000.0,"The data scientist will develop and implement new methods. Generous base salary and bonuses, Full health benefits, generous 401k match plan, flexible Friday..."
"Washington, DC",Data Scientist,        Central Intelligence Agency,91066.0,"Data Scientists organize and interpret Big Data to inform US decision makers, drive successful operations and shape CIA technology and resource investments...."
"Washington, DC",Data Scientist,        Workbridge Associates,125000.0,A leading provider of data and technology for companies that support and promote free enterprise is looking to bring on a Data Scientist with management...
"Washington, DC",Data Scientist,"    Gunther Douglas, Inc.",100000.0,
"Alexandria, VA",Research Development Engineer/Scientist,    TULK llc,160000.0,Greater than 15 years of relevant work experience with Bachelor's Degree and Master's Degree (may 7 years of additional relevant work experience for Bachelor's...
"Arlington, VA",Statistical Analyst,    MbSolutions Inc,80000.0,The Contractor shall develop data collection processes/procedures and formats for information for utilization by the Government....
"Washington, DC",Senior Data Scientist,        Workbridge Associates,125000.0,A leading provider of data and technology for companies that support and promote free enterprise is looking to bring on a Data Scientist to their analytics team...
"Washington, DC",NETWORK OPERATIONS RESEARCH ANALYST EAS,        United States Postal Service,88746.5,"The salary will be based on previous experience, salary history, and current postal pay policies. We offer excellent benefits including health and life..."
"Washington, DC 20036 (Downtown area)",Research Analyst,    American Society for Engineering Education (ASEE),50000.0,"As part of a team, participates in the development of project management plans and research/ evaluation plans...."
"Reston, VA 20190",Senior Data Scientist,    ZP Group,190000.0,"Data, big data, petabytes, PhD, statistics, computer science, machine learning, engineering, image classification, neural networks, data processing, algorithms,..."
"Washington, DC 20005 (Logan Circle area)",Credit Risk Transfer Research Analyst,    iiTS,140000.0,"SAS, R, SQL, Python, Tableau. Responsibilities include developing analytics-based data-driven investor marketing materials, identifying topics and issues for..."
"Alexandria, VA 22314 (Southwest Quadrant area)",Business Development/ Market Research Analyst,    Eyebrow Express,43200.0,Eyebrow Express is a personal services company located in Alexandria and we are looking to expand our operations by opening more locations in the Washington DC...
"Washington, DC",Data & Research Analyst,    The Council,82500.0,"Identify key macro and micro trends in the industry through robust research, leveraging data and analytics to produce meaningful insights...."
"Washington, DC",Machine Learning Data Engineer,        Jobspring Partners,125000.0,"Right now, this rapidly expanding division is seeking several Data Engineers/Scientists who have a strong background in machine learning...."
"Silver Spring, MD",Front End Developer,    FlashX,90000.0,Please note that we are NOT looking for data scientists. FlashX is looking for rising superstars in front end development to help build an open source platform...
"Springfield, VA",Data Scientist (TS/SCI Required),    Fawkes IDM,105000.0,Ensuring successful deployment of client’s analytics solutions and leveraging pre-existing analytics industry knowledge and technical integration and...
"Silver Spring, MD",Software Engineer,    FlashX,100000.0,Please note that we are not looking for data scientists. FlashX is looking for rising superstars in software engineering to help develop an open source platform...
"College Park, MD",Post-Doctoral Scientist,        University of Maryland,42500.0,"The salary range is $40-45k, commensurate with experience, plus a competitive fringe benefits package, including health benefits, retirement, 22 days of annual..."
"Gaithersburg, MD 20879",Research Assistant,"    Sirnaomics,Inc",31500.0,Possession of a Bachelor’s Degree or higherin Biochemistry or related discipline from an accredited college or university according to the Council for Higher...
"McLean, VA","2017-04-01 Software Engineer Earning $196,000",    EMF Industries,196000.0,"Our talented group of Data Scientists, Developers, PMs, and Designers is seeking an individual to augment our business intelligence team...."
"Washington, DC",Big Data/IoT Software Engineer,        Jobspring Partners,130000.0,"IoT, Big Data, Java, Scala, Python, Analytics, Sensor, Machine Learning, Spark, Accumulo, Kafka, RabbitMQ, ETL, NoSQL, Storm, Data Scientist, Github...."
"Washington, DC",Apps Developer,        Central Intelligence Agency,90936.0,"The CIA has ongoing requirements for entry-level and experienced Computer Scientists, Software Engineers and Web Designers and Publishers to serve as Apps..."
"Washington, DC",Analytic Methodologist,        Central Intelligence Agency,72951.0,"They also partner with substantive experts and data scientists to develop and prototype new methodological approaches and tools, applying them in novel ways to..."
"Washington, DC",Senior Product Manager,    Catalist,85000.0,"Catalist is home to a dedicated, creative team of technologists, data scientists and campaign experts who build best-in class data tools and science...."
"Columbia, MD 21044",Senior Systems Administrator,    Impact Research,92500.0,
"McLean, VA",Data Scientist:Veteran+Military Only,    Veteran Staffing Network of Easter Seals,150000.0,"Extensive knowledge of statistics/math, familiarity data structures, data analysis, and generally working with data, familiarity with, ideally, multiple..."
"Washington, DC",Machine Learning Data Engineer (Manager),        Jobspring Partners,140000.0,"Right now, this rapidly expanding division is seeking a multiple Machine Learning Data Engineers (senior level through Manager level) who have a strong..."
"Greenbelt, MD",HP020 Linux/Mac System Administrator,"        ADNET Systems, Inc.",80000.0,
"Washington, DC",Research Analyst - Law Firm,    Fawkes IDM,75000.0,"Performing legal, business and scientific reference and research using a variety of free and fee-based databases and websites...."
"Rockville, MD",Research Associate Level I (Process Development Dpt.),"    ProMetic BioTherapeutics, Inc. (PBT)",46000.0,A Bachelor’s Degree and 0-2 years of experience in the scientific field or in a related area. The candidate will be responsible for leaning basic purification...
"Arlington, VA 22201 (Lyon Village area)",Front End Engineer,        Workbridge Associates,140000.0,"They have built an experienced team of data scientists and retail market experts, and a development team that is changing the way retailers make decisions...."
"Alexandria, VA",Senior Credit Risk Transfer Research Analyst,    KVR Consultant,135000.0,"SAS, R, SQL, Python, Tableau. Responsibilities include developing analytics-based data-driven investor marketing materials, identifying topics and issues for..."
"Alexandria, VA",OPIR Scientist - Laser Specialist 1,    TULKORP.,97000.0,
"Springfield, VA",R & D Scientist **AMENDED,        National Geospatial-Intelligence Agency,120212.5,
"Washington, DC",VP of Advanced Analytics,    Harnham,250000.0,"You will manage and develop a team of Data Scientists and Analysts, but will take a lead on delivering solutions and recommendations to clients to enhance their..."
"Boston, MA",Data Scientist,        Darwin Recruitment,120000.0,"Data Scientist - Machine Learning - NLP - Python - R - Bayesian Statistics - Frequentist - Boston. Use machine learning nlp to a data rich environment,..."
"Somerville, MA",Technical Data Analyst,    Sharp Action LLC,70000.0,
"Boston, MA","Analyst/Senior Analyst, Advanced Analytics",        Liberty Mutual,94100.0,"Participate in discussions with key stakeholders, such as Underwriting, and GS Analytics modeling team consisting of data scientists to support development of..."
"Boston, MA","Senior Analyst, Advanced Analytics",        Liberty Mutual,94100.0,You will also support these data scientists in manual scoring of data for some deployed complex models. There is also the opportunity to learn to build simple...
"Boston, MA",Research Analyst III,        Commonwealth of Massachusetts,66890.0,"Design, plan and implement research activities in order to ensure the availability of required information and data;..."
"Boston, MA 02116 (South End area)",Data Engineer,        Jobspring Partners,150000.0,Analytics automation company in downtown Boston is looking to hire a Senior Data Scientist to join their newly formed Data Services team....
"Boston, MA",Senior Machine Learning Engineer,        Darwin Recruitment,175000.0,"Apply machine learning, NLP and deep learning methods to huge data sets. Machine Learning Engineer - Machine Learning - NLP - Java - Python - Spark - Boston...."
"Newton, MA",Research Analyst,"    Asset Recovery Advisors, Inc.",32500.0,Data entry pertaining to ongoing research and data management using excel and other processing software. Is a Massachusetts based research firm specializing in...
"Boston, MA",SENIOR DIRECTOR OF DATA SCIENCE - RETAIL,    Harnham,180000.0,Data Scientist | Director | Retail | Statistical Methods | Predictive Analytics | Machine Learning | Advanced....
"Boston, MA 02116 (South End area)",Site Reliability Engineer,        Workbridge Associates,130000.0,Manage Linux databases. The company has a very diverse group of developers and scientists from over 180 counties around the world....
"Cambridge, MA 02142 (East Cambridge area)","Lead Scientist, Computational Biology",        HireMinds,100000.0,Reporting results to scientific team and executive management. Data analysis and integration into refinements of the algorithm....
"Boston, MA",Research Analyst - fintech startup,    Bison,45000.0,
"Billerica, MA",Lead EMI Qualification Test Engineer,        CEC,120000.0,
"Framingham, MA 01701",Mid-level Machine Learning Engineer,        Workbridge Associates,140000.0,
"Boston, MA",Quantitative Analyst or Manager Decision Sciences,        Analytic Recruiting,110000.0,"Analytics, analyst, retail banking, statistical modeling, quantitative analyst, marketing analytics. Expertise with SAS, SQL, R and other tools...."
"Boston, MA",Software Development Engineer,        WDS Global Partners LLC,145000.0,Un sugervised experience applying machine learning and data mining:. Ability to work in a multidisciplinary group of scientists*....
"Boston, MA","NLP PRINCIPAL DATA SCIENTIST, WORLD-CLASS CONSULTANCY ROLE",    Harnham,170000.0,Data Scientist | Natural Language Processing | Statistical Methods | Predictive Analytics | Machine Learning | Advanced....
"Pittsburgh, PA",Statistical Marketing Analyst,    DBD Staffing,57500.0,"Manage data analysis support for segment targeting and opportunity assessment for Marketing Plan development with syndicated economic data (McGraw Hill, Hoovers..."
"Pittsburgh, PA",Research Review Analyst - Full Board,        The University of Pittsburgh,52884.0,"When appropriate, the RRA -FB may facilitate discussions at full board meetings or participate as a board member to ensure that risks to human subjects are..."
"Pittsburgh, PA 15236",Data Scientist/Ontologist,        ApTask,180000.0,"Leveraging new sources, increasing flexibility and ease of integrationShape data management practices, promote best practices and innovation regarding the use..."
"Pittsburgh, PA",Senior Statistician,    All-In Analytics,75500.0,"Experience with data mining, discovery, classification, transformation, and visualization. Knowledge of machine learning is preferred...."
"Philadelphia, PA",Data Scientist,"    Computer Enterprises, Inc. (CEI)",160000.0,"Excel, SQL, SAS, R, and Tableau) through determination of appropriate analytic approach (sample data analysis, trending, regression, etc.)...."
"Philadelphia, PA",Data Scientist,        Workbridge Associates,107500.0,"If you’re a Data Scientist or aspiring that leverages a healthy amount of Machine Learning and Predictive Modeling with either Python or R, then this could be a..."
"Philadelphia, PA 19102 (City Center West area)",Data Scientist,        Jobspring Partners,160000.0,This candidate will lead a team of data scientists and data engineers that develop the data processing engine that analyze and translate data from medical...
"Philadelphia, PA",Data Scientist Healthcare,    Harnham,130000.0,"Data Scientist - Healthcare. Data mining, machine learning, operations research, natural language processing, statistics, or information retrieval...."
"Ambler, PA 19002",Data Scientist for Marketing Technology,        Workbridge Associates,175000.0,"Health, dental, vision. Ability to work with R and C++. By earning the loyalty of customers through relevant and efficient experiences, my client has continual..."
"Philadelphia, PA 19103 (Belmont area)","Data Scientist - Analytical Experiments, Analytical Tools","    Computer Enterprises, Inc.",140000.0,"Excel, SQL, SAS, R, and Tableau) through determination of appropriate analytic approach (sample data analysis, trending, regression, etc.).Distilling analytic..."
"Philadelphia, PA",Principal Data Scientist,    Averity,157500.0,"You will analyze, manipulate and interpret massive amounts of data from various sources and use your big data (Spark, Python, R, Scala, Machine Learning,..."
"Wilmington, DE",Digital Marketing (Data Scientist),"    Kennedy Unlimited Inc, Professional Staffing",115000.0,"Use your current research and analysis skills to apply various statistical and machine learning techniques, to develop predictive models, experimental designs,..."
"Philadelphia, PA 19107 (City Center East area)",Senior Software Engineer (Scala),    Juno Search Partners,120000.0,"Their academic platform helps answer questions around data sharing and analysis, helping scientists and medical professionals make better decisions within..."
"Horsham, PA",Senior Statistician/Data Scientist-PHARMA,        Smith Hanley Associates,120000.0,
"Philadelphia, PA",Director of Data Science,    Averity,195000.0,
"Philadelphia, PA",Quantitative Analyst (Big Data Focus) at $10+ Billion Hedge...,    Averity,250000.0,We are looking for a Quantitative Analyst with experience utilizing big data to join our $10+ Billion Hedge Fund in the Philadelphia area....
"Philadelphia, PA",Data Science Manager Healthcare,    Harnham,170000.0,"Data mining, machine learning, operations research, natural language processing, statistics, or information retrieval...."
"Collegeville, PA",Clinical Study Associate Trial Master File – TMF,    inVentiv Health Clincal,56000.0,"At least 3 years’ experience from a CRO or Sponsor Company working in clinical research, clinical operations or data scientist roles (eg Study Manager, Clinical..."
"Horsham, PA 19044",Angular Software Developer,        Jobspring Partners,100000.0,"The engineering team is a mixture of data scientists, back-end engineers and front-end developers. Full health, dental, and vision insurance...."
"Philadelphia, PA 19148 (South Philadelphia area)",Personal Care Formulation Scientist,    Chatham Group,57000.0,"Assists in the development of the promotional materials such as demo formulations, formulation data sheets, trade magazine articles, technical data sheets,..."
"Atlanta, GA",Machine learning / AI / Restful API web services Engineer at...,    CareerMonks,120000.0,"Familiarity with No SQL databases, bot framework, data streaming and integrating unstructured data will be plus...."
"Atlanta, GA",Data Scientist - Supply Chain,        Analytic Recruiting,107500.0,"Supply Chain, SAS, R, Predictive Modeling, Predictive Analytics, SQL. Data Scientist, Supply Chain sought by Fortune 500 company to be part of a leading-edge..."
"Atlanta, GA",Supervisory Health Scientist,        Centers for Disease Control and Prevention,143516.0,"Whether we are protecting the American people from public health threats, researching emerging diseases, or mobilizing public health programs with our domestic..."
"Marietta, GA",Senior Research Analyst,"    Competitive Promotion Report, LLC",50000.0,"Since 1989, Competitive Promotion Report, LLC (CPR) has provided competitive market intelligence and insights to leading manufacturers in the Health, Beauty &..."
